{
  "$schema": "https://json-schema.org/draft/2020-12/schema",
  "$id": "https://choregos.dev/schemas/policy.schema.json",
  "title": "Policy",
  "description": "A project's policy: budgets, approvals, attempts, scope, sandbox, findings, release train.",
  "type": "object",
  "required": ["apiVersion", "kind", "metadata"],
  "additionalProperties": false,
  "properties": {
    "apiVersion": { "const": "choregos/v1" },
    "kind": { "const": "Policy" },
    "metadata": {
      "type": "object",
      "required": ["name", "version"],
      "additionalProperties": false,
      "properties": {
        "name": { "type": "string", "pattern": "^[a-z0-9][a-z0-9-]{0,62}$" },
        "version": { "type": "integer", "minimum": 1 },
        "preset": { "type": "string", "enum": ["solo", "team", "regulated"] },
        "description": { "type": "string" }
      }
    },
    "budgets": {
      "type": "object",
      "additionalProperties": false,
      "properties": {
        "ticket_usd": {
          "type": "object",
          "description": "Cost ceiling per work item, by size.",
          "additionalProperties": false,
          "properties": {
            "S": { "type": "number", "exclusiveMinimum": 0 },
            "M": { "type": "number", "exclusiveMinimum": 0 },
            "L": { "type": "number", "exclusiveMinimum": 0 },
            "XL": { "type": "number", "exclusiveMinimum": 0 }
          }
        },
        "stage_usd": {
          "type": "object",
          "description": "Ceiling per step: role → size → USD. The `default` key applies to the roles not listed.",
          "additionalProperties": {
            "type": "object",
            "additionalProperties": false,
            "properties": {
              "S": { "type": "number", "exclusiveMinimum": 0 },
              "M": { "type": "number", "exclusiveMinimum": 0 },
              "L": { "type": "number", "exclusiveMinimum": 0 },
              "XL": { "type": "number", "exclusiveMinimum": 0 }
            }
          }
        },
        "max_turns": { "type": "object", "additionalProperties": { "type": "integer", "minimum": 1 } },
        "max_minutes": { "type": "object", "additionalProperties": { "type": "integer", "minimum": 1 } },
        "tool_calls_per_run": { "type": ["integer", "null"], "minimum": 0, "description": "Catalogue tool calls allowed per run; null means no ceiling." },
        "daily_project_usd": { "type": "number", "exclusiveMinimum": 0 },
        "alert_at_ratio": { "type": "number", "minimum": 0, "maximum": 1, "default": 0.8 }
      }
    },
    "approvals": {
      "type": "object",
      "description": "Human approval rules, by kind of decision.",
      "additionalProperties": false,
      "properties": {
        "spec": { "$ref": "#/$defs/approvalRule" },
        "merge": { "$ref": "#/$defs/approvalRule" },
        "prod": { "$ref": "#/$defs/approvalRule" },
        "scope_change": { "$ref": "#/$defs/approvalRule" }
      }
    },
    "attempts": {
      "type": "object",
      "additionalProperties": false,
      "properties": {
        "default_max": { "type": "integer", "minimum": 1, "default": 2, "description": "Accepted, not enforced: a transition's attempts are its workflow's max_attempts, lowered only by by_role." },
        "by_role": { "type": "object", "additionalProperties": { "type": "integer", "minimum": 1 }, "description": "A ceiling on an agent transition's max_attempts, per role (ADR 0047)." },
        "dod_iterations": { "type": "integer", "minimum": 0, "maximum": 10, "default": 3 },
        "max_stages_per_ticket": { "type": "integer", "minimum": 1, "default": 50, "description": "Agent stages a work item may run, retries included; the next is refused and the work item goes to a person (ADR 0047)." }
      }
    },
    "scope": {
      "type": "object",
      "additionalProperties": false,
      "properties": {
        "auto_grant_max_files": { "type": "integer", "minimum": 0, "default": 3 },
        "deny_paths": { "type": "array", "items": { "type": "string" },
          "default": [".choregos/**", ".github/workflows/**", "charts/**"] },
        "max_diff_files": { "type": "integer", "minimum": 1, "default": 60 },
        "max_diff_lines": { "type": "integer", "minimum": 1, "default": 3000 }
      }
    },
    "sandbox": {
      "type": "object",
      "additionalProperties": false,
      "properties": {
        "runtime": { "type": "string", "enum": ["default", "gvisor", "kata"], "default": "default" },
        "deny_commands": { "type": "array", "items": { "type": "string" },
          "default": ["kubectl", "terraform apply", "git push --force", "curl | sh", "sudo"] },
        "network": {
          "type": "object",
          "additionalProperties": false,
          "properties": {
            "allow_domains": { "type": "array", "items": { "type": "string" } },
            "deny_by_default": { "type": "boolean", "default": true },
            "deny_domains": { "type": "array", "items": { "type": "string" } },
            "per_host_per_minute": { "type": ["integer", "null"], "minimum": 1 },
            "per_run_per_minute": { "type": ["integer", "null"], "minimum": 1 },
            "builtin_web_tools": { "type": "string", "enum": ["allow", "deny"], "default": "allow" }
          }
        },
        "llm_security_analyzer": { "type": "boolean", "default": false },
        "unknown_requests": {
          "type": "string",
          "enum": ["allow", "reject"],
          "default": "allow",
          "description": "A permission request of an unknown kind: let through and logged (allow), or refused (reject)"
        },
        "prompt_injection": {
          "type": "string",
          "enum": ["ignore", "warn", "block"],
          "default": "warn",
          "description": "A prompt injection spotted in what the agent will read: log it (warn), stop the step (block), do not look (ignore)"
        },
        "suspend_max_hours": {
          "type": "number",
          "minimum": 0,
          "default": 24,
          "description": "How long a sandbox may stay suspended while a person answers its agent's question, with an executor that can suspend (agent_sandbox). Beyond it the sandbox is destroyed and the stage replays. 0: never suspend"
        }
      }
    },
    "findings": {
      "type": "object",
      "additionalProperties": false,
      "properties": {
        "max_per_run": { "type": "integer", "minimum": 0, "default": 5 },
        "dedupe_threshold": { "type": "number", "minimum": 0, "maximum": 1, "default": 0.86 },
        "auto_agent_ready_sizes": { "type": "array", "items": { "type": "string", "enum": ["S", "M", "L", "XL"] },
          "default": [] },
        "notify_severities": { "type": "array", "items": { "type": "string", "enum": ["low", "medium", "high", "critical"] },
          "default": ["critical"] },
        "false_positive_alert_ratio": { "type": "number", "minimum": 0, "maximum": 1, "default": 0.3 }
      }
    },
    "memory": {
      "type": "object",
      "additionalProperties": false,
      "properties": {
        "enabled": { "type": "boolean", "default": true },
        "context_budget_tokens": { "type": "object", "additionalProperties": { "type": "integer", "minimum": 0 } },
        "auto_accept_after_runs": { "type": "integer", "minimum": 1, "default": 2 },
        "read_timeout_ms": { "type": "integer", "minimum": 50, "default": 300 }
      }
    },
    "context": {
      "type": "object",
      "description": "Fewer tokens per run (ADR 0055): rtk filters shell output, headroom compresses tool results. Absent = everything off; the deployment's kill switch wins over the policy.",
      "additionalProperties": false,
      "properties": {
        "shell_filter": { "type": "string", "enum": ["none", "rtk"], "default": "none" },
        "compression": { "type": "string", "enum": ["none", "headroom"], "default": "none" },
        "headroom_profile": { "type": "string", "enum": ["coding", "balanced", "general"], "default": "coding" },
        "on_unavailable": { "type": "string", "enum": ["bypass", "fail"], "default": "bypass",
          "description": "When the compression proxy does not start: bypass to the gateway and journal it, or fail the stage." },
        "rtk_exclude_commands": { "type": "array", "items": { "type": "string" }, "default": [],
          "description": "Commands whose output the shell filter leaves raw." },
        "per_role": {
          "type": "object",
          "description": "Per stage role, what changes from the project's values; an absent field keeps them.",
          "additionalProperties": {
            "type": "object",
            "additionalProperties": false,
            "properties": {
              "shell_filter": { "type": "string", "enum": ["none", "rtk"] },
              "compression": { "type": "string", "enum": ["none", "headroom"] },
              "headroom_profile": { "type": "string", "enum": ["coding", "balanced", "general"] }
            }
          }
        }
      }
    },
    "review": {
      "type": "object",
      "additionalProperties": false,
      "properties": {
        "cross_backend": { "type": "boolean", "default": false,
          "description": "The review backend must differ from the implementation's." },
        "require_human_for_risk": { "type": "array", "items": { "type": "string", "enum": ["low", "medium", "high"] },
          "default": ["high"] }
      }
    },
    "release_train": {
      "type": "object",
      "description": "Configuration per environment (docs/plan/05 §5.2).",
      "additionalProperties": { "$ref": "#/$defs/trainEnv" }
    },
    "web_search": {
      "type": "object",
      "description": "The built-in web_search tool (ADR 0083): a project can only narrow the organisation's ceiling, which opens it.",
      "additionalProperties": false,
      "properties": {
        "mode": { "type": "string", "enum": ["allow", "deny"], "default": "allow" },
        "max_query_retention_days": { "type": ["integer", "null"], "minimum": 0,
          "description": "The longest a backend may keep a query; null: the ceiling's bound only." },
        "allow_query_reuse": { "type": "boolean", "default": false,
          "description": "Whether a backend may reuse queries (train, rank, re-index)." }
      }
    }
  },
  "$defs": {
    "approvalRule": {
      "type": "object",
      "required": ["required"],
      "additionalProperties": false,
      "properties": {
        "required": { "type": "string", "enum": ["always", "never", "by_size", "by_risk"] },
        "group": { "type": "string" },
        "sizes": { "type": "array", "items": { "type": "string", "enum": ["S", "M", "L", "XL"] } },
        "risks": { "type": "array", "items": { "type": "string", "enum": ["low", "medium", "high"] } },
        "timeout_hours": { "type": "integer", "minimum": 1 }
      }
    },
    "trainEnv": {
      "type": "object",
      "additionalProperties": false,
      "properties": {
        "mode": { "type": "string", "enum": ["auto_sync", "train"], "default": "train" },
        "schedule": { "type": "string", "description": "Cron (5 fields), in the project's time zone." },
        "timezone": { "type": "string", "default": "Europe/Paris" },
        "windows": { "type": "array", "items": { "type": "string" },
          "description": "Allowed windows, e.g. 'Mon-Thu 09:00-18:00'." },
        "batch_min": { "type": "integer", "minimum": 1, "default": 1 },
        "batch_max": { "type": "integer", "minimum": 1, "default": 8 },
        "soak_minutes": { "type": "integer", "minimum": 0, "default": 10 },
        "approval": {
          "type": "object",
          "additionalProperties": false,
          "properties": {
            "group": { "type": "string" },
            "required": { "type": "boolean", "default": false },
            "timeout_hours": { "type": "integer", "minimum": 1, "default": 4 }
          }
        },
        "canary": {
          "type": "object",
          "additionalProperties": false,
          "properties": {
            "steps": { "type": "array", "items": { "type": "integer", "minimum": 1, "maximum": 100 } },
            "analysis": { "type": "string" },
            "step_minutes": { "type": "array", "items": { "type": "integer", "minimum": 0 } }
          }
        },
        "express_lane": {
          "type": "object",
          "additionalProperties": false,
          "properties": {
            "label": { "type": "string", "default": "hotfix" },
            "soak_minutes": { "type": "integer", "minimum": 0, "default": 5 },
            "skip_schedule": { "type": "boolean", "default": true },
            "approval": {
              "type": "object",
              "additionalProperties": false,
              "properties": { "group": { "type": "string" }, "required": { "type": "boolean", "default": true } }
            }
          }
        },
        "freeze": { "type": "boolean", "default": false },
        "auto_rollback": { "type": "boolean", "default": true },
        "freeze_on_rollback": { "type": "boolean", "default": true },
        "terraform": {
          "type": "object",
          "additionalProperties": false,
          "properties": {
            "via": { "type": "string", "enum": ["atlantis", "none"], "default": "none" },
            "apply_requires_approval": { "type": "boolean", "default": true }
          }
        }
      }
    }
  }
}
